{
  "schema_version": "intraday_monitor_panel.v1",
  "workbench": "Intraday Monitor",
  "panel": "Intraday Monitor Exception Queue Panel",
  "route": "/monitor",
  "fixture_state": "empty",
  "context": {
    "trading_day": "2026-06-14",
    "session_id": "intraday-monitor.fixture.20260614.002",
    "monitor_checkpoint_id": "intraday-monitor.checkpoint.empty.001",
    "monitor_checkpoint_ts": "2026-06-14T16:35:36Z",
    "stream_state": "empty",
    "projection_owner": "account-console-contracts",
    "source_authority": "deterministic_fixture"
  },
  "lag_summary": {
    "max_lag_ms": 0,
    "stale_stream_count": 0,
    "open_incident_count": 0,
    "blocked_source_count": 0
  },
  "exceptions": [],
  "streams": [],
  "incidents": [],
  "blockers": [],
  "source_refs": [
    {
      "kind": "monitor_snapshot",
      "owner": "account-console-contracts",
      "source_ref": "fixture://intraday-monitor/empty",
      "checksum": "sha256:b4b4b4b4b4b4b4b4b4b4b4b4b4b4b4b4b4b4b4b4b4b4b4b4b4b4b4b4b4b4b4b4",
      "authority": "deterministic empty monitor fixture; absence is not runtime proof"
    }
  ],
  "boundaries": {
    "read_only_projection": true,
    "runtime_truth": false,
    "account_truth": false,
    "order_truth": false,
    "ledger_truth": false,
    "ui_truth": false,
    "paper_ready": false,
    "live_ready": false,
    "broker_tradable": false,
    "admission_truth": false,
    "capital_truth": false,
    "action_controls": false
  },
  "rejection_rules": [
    "Reject empty fixture as proof that no runtime incident exists.",
    "Reject empty exception queue as HFT readiness."
  ]
}
